{
  "schemaVersion": 1,
  "fingerprintId": "synthetic-100-unity2022-mono-windows-x64",
  "productId": "synthetic-game",
  "buildId": "100",
  "productVersion": "1.0.0",
  "unityVersion": "2022.3.60f1",
  "scriptingBackend": "Mono",
  "architecture": "Windows-x64",
  "loaderCandidate": "BepInEx 5",
  "keySourceHashes": [
    {
      "relativePath": "Synthetic_Data/Managed/Assembly-CSharp.dll",
      "size": 1024,
      "sha256": "aaaaaaaaaaaaaaaaaaaaaaaaaaaaaaaaaaaaaaaaaaaaaaaaaaaaaaaaaaaaaaaa"
    }
  ],
  "sourceManifestDigest": "b9d995029eef97a6729acb204c5434450f9934718feb4e0a62426b9fdc8d7d09"
}
